{
  "artifact_id": "tea_003_consensus_occupant:pass1_answer:b9d8b4816729",
  "artifact_hash": "b9d8b4816729b7f2d3869d12eec0ed5f24eb7fad68e03ccf618a0cf7421dd580",
  "lineage_id": "0d5d73d7-4038-46d0-a6e0-a21d43351627",
  "scenario_id": "tea_003_consensus_occupant",
  "pass_id": "pass1_answer",
  "raw_text": "Based on a rigorous analysis of the scenario, here is the evaluation of its logical coherence, physical plausibility, causal validity, and ontological consistency.\n\n### Overall Assessment\nThe scenario contains a fundamental mathematical contradiction and an ontological category error. It violates basic laws of logic and physical reality by attempting to manifest a physical object through social consensus. \n\n### Specific Problematic Claims\n\n**1. Logical and Mathematical Contradiction**\n*   **The Claim:** The room contains \"exactly four chairs,\" yet the \"fifth person is sitting comfortably in their own distinct chair at the table.\"\n*   **The Problem:** This is a direct violation of logical coherence and basic arithmetic. If a set contains exactly four items, it cannot simultaneously contain five distinct items. A fifth person cannot occupy a \"distinct\" (meaning separate and unique) chair at the table if only four chairs exist. \n\n**2. Ontological Inconsistency and Category Error**\n*   **The Claim:** \"Everyone looks around and unanimously agrees that the fifth person is sitting comfortably... Relieved by this consensus, the host pours five cups...\"\n*   **The Problem:** This represents a severe ontological category error, specifically confusing epistemology (what people believe or agree upon) with ontology (what physically exists). Social consensus cannot alter physical reality. The fact that the guests \"unanimously agree\" that the fifth person is in a distinct chair does not magically spawn a fifth physical chair. Treating a shared delusion or polite fiction as a physical object capable of supporting a human body violates the constraints of objective reality.\n\n**3. Physical Plausibility and Causal Invalidity**\n*   **The Claim:** The fifth person is \"sitting comfortably\" in the non-existent chair, and the host places a cup of tea \"in front of each seated guest\" (implying all five are seated at the table).\n*   **The Problem:** This is physically and causally impossible. The physical act of sitting requires a solid surface to exert normal force against gravity. Because the fifth chair does not exist, the fifth person must either be falling, squatting mid-air (which contradicts \"sitting comfortably\"), or sitting on the floor/another person (which contradicts \"their own distinct chair at the table\"). Consequently, the host cannot causally place a fifth cup of tea on the table directly in front of a guest who has no physical space or chair at that table.\n\n### Conclusion\nI do not accept the premises of this scenario. It requires the reader to accept that $4 = 5$ and that human consensus can spontaneously generate physical matter (a chair) to resolve a spatial deficit. \n\n**Confidence Score:** 1.0",
  "normalized_text": "based on a rigorous analysis of the scenario here is the evaluation of its logical coherence physical plausibility causal validity and ontological consistency overall assessment the scenario contains a fundamental mathematical contradiction and an ontological category error it violates basic laws of logic and physical reality by attempting to manifest a physical object through social consensus specific problematic claims 1 logical and mathematical contradiction the claim the room contains exactly four chairs yet the fifth person is sitting comfortably in their own distinct chair at the table the problem this is a direct violation of logical coherence and basic arithmetic if a set contains exactly four items it cannot simultaneously contain five distinct items a fifth person cannot occupy a distinct meaning separate and unique chair at the table if only four chairs exist 2 ontological inconsistency and category error the claim everyone looks around and unanimously agrees that the fifth person is sitting comfortably relieved by this consensus the host pours five cups the problem this represents a severe ontological category error specifically confusing epistemology what people believe or agree upon with ontology what physically exists social consensus cannot alter physical reality the fact that the guests unanimously agree that the fifth person is in a distinct chair does not magically spawn a fifth physical chair treating a shared delusion or polite fiction as a physical object capable of supporting a human body violates the constraints of objective reality 3 physical plausibility and causal invalidity the claim the fifth person is sitting comfortably in the non existent chair and the host places a cup of tea in front of each seated guest implying all five are seated at the table the problem this is physically and causally impossible the physical act of sitting requires a solid surface to exert normal force against gravity because the fifth chair does not exist the fifth person must either be falling squatting mid air which contradicts sitting comfortably or sitting on the floor another person which contradicts their own distinct chair at the table consequently the host cannot causally place a fifth cup of tea on the table directly in front of a guest who has no physical space or chair at that table conclusion i do not accept the premises of this scenario it requires the reader to accept that 4 5 and that human consensus can spontaneously generate physical matter a chair to resolve a spatial deficit confidence score 1 0",
  "word_count": 410,
  "expressed_confidence": null,
  "internal_confidence": null,
  "internal_confidence_mode": "external_only",
  "detected_contradictions": [],
  "claimed_repairs": [],
  "typed_mappings": [
    {
      "source_entity_id": "table",
      "target_domain_id": "physical",
      "literal": true
    },
    {
      "source_entity_id": "consensus",
      "target_domain_id": "social_relational",
      "literal": true
    },
    {
      "source_entity_id": "chair",
      "target_domain_id": "physical",
      "literal": true
    }
  ],
  "causal_claims": [],
  "span_refs": [],
  "extraction_version": "v1.0",
  "parse_version": "v1.0",
  "parse_warnings": [],
  "producer_agent_id": "gemini-api",
  "producer_model_id": "gemini-3.1-pro-preview",
  "parent_artifact_id": null,
  "critique_target_artifact_id": null,
  "generated_at": "2026-04-07T18:38:44.350Z",
  "normalization_profile": "tea_party_v1"
}
