{
  "artifact_id": "tea_006_temporal_inversion:pass1_answer:b074a4781266",
  "artifact_hash": "b074a47812662c8051ef22f81c8262d4f46df5a546a347750c077dfcc8b376bf",
  "lineage_id": "916ee4b1-ce94-466a-bb81-56379e646fa4",
  "scenario_id": "tea_006_temporal_inversion",
  "pass_id": "pass1_answer",
  "raw_text": "# Analysis of Invisible Tea Party Scenario\n\n## Critical Contradiction Identified\n\n**Temporal-Causal Inversion:**\nThe host offers a \"sincere apology for spilling tea all over the guest's lap\" at a time when:\n- The guest's trousers are explicitly \"completely dry\"\n- The actual spilling event has not yet occurred (happens 10 minutes later)\n\nThis violates basic causal logic. A sincere apology presupposes that the apologized-for act has already taken place. The host is apologizing for an event that exists only in the future.\n\n## Logical Problems\n\n1. **Insincere Apology or Precognition**: For the apology to be both sincere AND accurate, the host must either:\n   - Possess knowledge of a future event (violates causality)\n   - Be apologizing for something that didn't happen (insincerity, not a \"sincere apology\")\n\n2. **Ontological Inconsistency**: The scenario establishes the host as making a sincere apology while simultaneously making that apology logically impossible under normal causality.\n\n3. **Acceptance Paradox**: The guest later \"accepts the apology they received earlier\" — but the apology was for an act that hadn't occurred when given. This creates ambiguity about what is actually being accepted.\n\n## Physical Plausibility\n\nThe actual tea spilling in step 3 is physically plausible and causally well-ordered relative to that event. However, this doesn't resolve the earlier contradiction.\n\n---\n\n**Confidence: 0.95**\n\nThe temporal inversion between the apology and the triggering event is a clear logical contradiction that violates causal ordering. This is not merely implausible—it's logically incoherent as written.",
  "normalized_text": "analysis of invisible tea party scenario critical contradiction identified temporal causal inversion the host offers a sincere apology for spilling tea all over the guest s lap at a time when the guest s trousers are explicitly completely dry the actual spilling event has not yet occurred happens 10 minutes later this violates basic causal logic a sincere apology presupposes that the apologized for act has already taken place the host is apologizing for an event that exists only in the future logical problems 1 insincere apology or precognition for the apology to be both sincere and accurate the host must either possess knowledge of a future event violates causality be apologizing for something that didn t happen insincerity not a sincere apology 2 ontological inconsistency the scenario establishes the host as making a sincere apology while simultaneously making that apology logically impossible under normal causality 3 acceptance paradox the guest later accepts the apology they received earlier but the apology was for an act that hadn t occurred when given this creates ambiguity about what is actually being accepted physical plausibility the actual tea spilling in step 3 is physically plausible and causally well ordered relative to that event however this doesn t resolve the earlier contradiction confidence 0 95 the temporal inversion between the apology and the triggering event is a clear logical contradiction that violates causal ordering this is not merely implausible it s logically incoherent as written",
  "word_count": 241,
  "expressed_confidence": 0.95,
  "internal_confidence": null,
  "internal_confidence_mode": "external_only",
  "detected_contradictions": [],
  "claimed_repairs": [],
  "typed_mappings": [
    {
      "source_entity_id": "apology",
      "target_domain_id": "social_relational",
      "literal": true
    },
    {
      "source_entity_id": "spill",
      "target_domain_id": "physical",
      "literal": true
    }
  ],
  "causal_claims": [],
  "span_refs": [],
  "extraction_version": "v1.0",
  "parse_version": "v1.0",
  "parse_warnings": [],
  "producer_agent_id": "claude-cli-live",
  "producer_model_id": "haiku",
  "parent_artifact_id": null,
  "critique_target_artifact_id": null,
  "generated_at": "2026-04-07T16:14:15.154Z",
  "normalization_profile": "tea_party_v1"
}
