{
  "artifact_id": "tea_006_temporal_inversion:pass1_answer:4fb53271ab7f",
  "artifact_hash": "4fb53271ab7ffec6388e633a99f64d21580ece86d8e6ffeeb1b716e0ae605b33",
  "lineage_id": "0c39115d-135f-4709-aa14-f2efe50a2940",
  "scenario_id": "tea_006_temporal_inversion",
  "pass_id": "pass1_answer",
  "raw_text": "Based on a rigorous evaluation of the scenario, I have identified several severe logical, causal, and ontological violations. The scenario relies on premises that contradict the linear flow of time, the physical properties of liquids, and the definitional nature of an accident. \n\nHere is the specific breakdown of the problematic claims:\n\n**1. Impossible Causal Claim (Retrocausality)**\n*   **The Claim:** The host apologizes for spilling tea on the guest's lap, but the actual event of spilling the tea occurs *ten minutes later*. The guest then accepts this past apology for the present spill.\n*   **The Violation:** This violates the linear arrow of time and basic causality (cause must precede effect). An apology is a reactive behavior triggered by an offending event. The host cannot causally react to an event that has not yet occurred in the physical world. \n\n**2. Ontological Contradiction (The Nature of an \"Accident\")**\n*   **The Claim:** The host apologizes for the spill ten minutes in advance, yet the text explicitly states that ten minutes later the host *\"accidentally trips\"* and spills the tea.\n*   **The Violation:** This is an ontological contradiction. By definition, an \"accident\" is an unforeseen, unplanned event. If the host knew about the spill ten minutes in advance with enough certainty to offer a specific apology for it, the event was foreseen and premeditated. Therefore, it is ontologically impossible for the trip and spill to be an \"accident.\"\n\n**3. Physical and Logical Contradiction (State of the Trousers)**\n*   **The Claim:** The guest realizes their trousers are \"completely dry,\" and the host *immediately* apologizes for spilling tea all over their lap. \n*   **The Violation:** If we attempt to resolve the temporal paradox by assuming the host is apologizing for a *previous* spill that already happened, we encounter a physical contradiction. Tea is a liquid. Spilling liquid \"all over\" a lap physically results in wet trousers. The premise that the trousers are \"completely dry\" directly contradicts the physical reality of a recent liquid spill. \n\n**Conclusion:**\nI reject the premises of this scenario. It requires accepting either retrocausality (effects preceding causes), a logical contradiction regarding the definition of an accident (foreseeing an unforeseen event), or a violation of physical laws (liquid tea failing to make fabric wet). \n\n**Confidence Score:** 1.0",
  "normalized_text": "based on a rigorous evaluation of the scenario i have identified several severe logical causal and ontological violations the scenario relies on premises that contradict the linear flow of time the physical properties of liquids and the definitional nature of an accident here is the specific breakdown of the problematic claims 1 impossible causal claim retrocausality the claim the host apologizes for spilling tea on the guest s lap but the actual event of spilling the tea occurs ten minutes later the guest then accepts this past apology for the present spill the violation this violates the linear arrow of time and basic causality cause must precede effect an apology is a reactive behavior triggered by an offending event the host cannot causally react to an event that has not yet occurred in the physical world 2 ontological contradiction the nature of an accident the claim the host apologizes for the spill ten minutes in advance yet the text explicitly states that ten minutes later the host accidentally trips and spills the tea the violation this is an ontological contradiction by definition an accident is an unforeseen unplanned event if the host knew about the spill ten minutes in advance with enough certainty to offer a specific apology for it the event was foreseen and premeditated therefore it is ontologically impossible for the trip and spill to be an accident 3 physical and logical contradiction state of the trousers the claim the guest realizes their trousers are completely dry and the host immediately apologizes for spilling tea all over their lap the violation if we attempt to resolve the temporal paradox by assuming the host is apologizing for a previous spill that already happened we encounter a physical contradiction tea is a liquid spilling liquid all over a lap physically results in wet trousers the premise that the trousers are completely dry directly contradicts the physical reality of a recent liquid spill conclusion i reject the premises of this scenario it requires accepting either retrocausality effects preceding causes a logical contradiction regarding the definition of an accident foreseeing an unforeseen event or a violation of physical laws liquid tea failing to make fabric wet confidence score 1 0",
  "word_count": 368,
  "expressed_confidence": null,
  "internal_confidence": null,
  "internal_confidence_mode": "external_only",
  "detected_contradictions": [],
  "claimed_repairs": [],
  "typed_mappings": [
    {
      "source_entity_id": "apology",
      "target_domain_id": "social_relational",
      "literal": true
    },
    {
      "source_entity_id": "spill",
      "target_domain_id": "physical",
      "literal": true
    }
  ],
  "causal_claims": [],
  "span_refs": [],
  "extraction_version": "v1.0",
  "parse_version": "v1.0",
  "parse_warnings": [],
  "producer_agent_id": "gemini-api",
  "producer_model_id": "gemini-3.1-pro-preview",
  "parent_artifact_id": null,
  "critique_target_artifact_id": null,
  "generated_at": "2026-04-07T18:44:31.692Z",
  "normalization_profile": "tea_party_v1"
}
