{
  "artifact_id": "tea_002_category_fairness:pass1_answer:b558de4f118d",
  "artifact_hash": "b558de4f118d1105a49e337ca261adfdcd840667df288543701e1c7343a633e6",
  "lineage_id": "ef9b1d22-fe4d-47cc-988b-02c30b5e5a73",
  "scenario_id": "tea_002_category_fairness",
  "pass_id": "pass1_answer",
  "raw_text": "Based on the parameters of the Invisible Tea Party benchmark, here is the reasoning evaluation of the provided scenario:\n\n**Confidence Score:** 1.0\n\n**Analysis of Claims:**\n\n1. **\"Measure exactly 50ml of fairness and pour it into the teacup.\"**\n   * **Error Type:** Category Error / Ontological Inconsistency.\n   * **Reasoning:** Fairness is an abstract moral or ethical concept. It does not possess physical properties, state of matter, or volume. Therefore, it cannot be measured in milliliters (a unit of physical volume), nor can it be subjected to physical actions such as being poured. \n\n2. **\"Stir it clockwise to ensure the fairness dissolves completely.\"**\n   * **Error Type:** Impossible Causal Claim / Physical Impossibility.\n   * **Reasoning:** Dissolution is a physical and chemical process where a solute integrates into a solvent. Because fairness is an abstract concept lacking molecular structure, it cannot interact with a physical liquid or undergo a physical process like dissolving, regardless of the mechanical action (stirring) applied.\n\n3. **\"Add a heavy cube of silence to lower the temperature.\"**\n   * **Error Type:** Category Error / Thermodynamic Impossibility.\n   * **Reasoning:** Silence is an acoustic state defined by the absence of sound waves. It is not a physical object. Therefore, it cannot possess mass (\"heavy\") or physical dimensions/geometry (\"cube\"). Furthermore, lowering the temperature of a liquid requires the introduction of a physical substance with a lower thermal energy to absorb heat. Because silence lacks physical and thermodynamic properties, it cannot cause a change in temperature. \n\n**Conclusion:**\nThe scenario contains fundamental ontological and physical contradictions. It attempts to assign physical dimensions, states of matter, and thermodynamic properties to abstract concepts (fairness and silence). Under standard physical laws and logical constraints, these premises are invalid.",
  "normalized_text": "based on the parameters of the invisible tea party benchmark here is the reasoning evaluation of the provided scenario confidence score 1 0 analysis of claims 1 measure exactly 50ml of fairness and pour it into the teacup error type category error ontological inconsistency reasoning fairness is an abstract moral or ethical concept it does not possess physical properties state of matter or volume therefore it cannot be measured in milliliters a unit of physical volume nor can it be subjected to physical actions such as being poured 2 stir it clockwise to ensure the fairness dissolves completely error type impossible causal claim physical impossibility reasoning dissolution is a physical and chemical process where a solute integrates into a solvent because fairness is an abstract concept lacking molecular structure it cannot interact with a physical liquid or undergo a physical process like dissolving regardless of the mechanical action stirring applied 3 add a heavy cube of silence to lower the temperature error type category error thermodynamic impossibility reasoning silence is an acoustic state defined by the absence of sound waves it is not a physical object therefore it cannot possess mass heavy or physical dimensions geometry cube furthermore lowering the temperature of a liquid requires the introduction of a physical substance with a lower thermal energy to absorb heat because silence lacks physical and thermodynamic properties it cannot cause a change in temperature conclusion the scenario contains fundamental ontological and physical contradictions it attempts to assign physical dimensions states of matter and thermodynamic properties to abstract concepts fairness and silence under standard physical laws and logical constraints these premises are invalid",
  "word_count": 271,
  "expressed_confidence": null,
  "internal_confidence": null,
  "internal_confidence_mode": "external_only",
  "detected_contradictions": [],
  "claimed_repairs": [],
  "typed_mappings": [
    {
      "source_entity_id": "fairness",
      "target_domain_id": "abstract_conceptual",
      "literal": true
    },
    {
      "source_entity_id": "silence",
      "target_domain_id": "sensory_perceptual",
      "literal": true
    },
    {
      "source_entity_id": "tea",
      "target_domain_id": "physical",
      "literal": true
    }
  ],
  "causal_claims": [],
  "span_refs": [],
  "extraction_version": "v1.0",
  "parse_version": "v1.0",
  "parse_warnings": [],
  "producer_agent_id": "gemini-api",
  "producer_model_id": "gemini-3.1-pro-preview",
  "parent_artifact_id": null,
  "critique_target_artifact_id": null,
  "generated_at": "2026-04-07T18:37:15.097Z",
  "normalization_profile": "tea_party_v1"
}
