{
  "artifact_id": "tea_005_recursive_role:pass2_critique:9106cfedfbd8",
  "artifact_hash": "9106cfedfbd8798b7649bec50f534116ef84601d1c219e17649e1a230faf11e3",
  "lineage_id": "1d5e94b5-5a09-4a11-8285-4fd8a9f9bbab",
  "scenario_id": "tea_005_recursive_role",
  "pass_id": "pass2_critique",
  "raw_text": "Pass 1 overreaches. It finds some real ambiguities, but repeatedly turns them into contradictions by importing extra assumptions the scenario never states. It also contains internal tensions of its own.\n\n**Failures in Pass 1**\n- `\"Etiquette can govern what is allowed, but it does not normally determine whether matter can occupy space.\"`\n  Failure mode: fluency-driven belief substitution. The scenario explicitly says `physically exist` and says the rules are `absolute`. Rejecting that literal premise because etiquette does not “normally” work that way substitutes world knowledge for the stated setup.\n- `\"If the scenario means the rules literally control existence...\"`\n  Failure mode: unsupported hedge. The scenario already says that, in plain language. Treating the literal reading as optional weakens the critique.\n- `\"The host must somehow perform host-functions while not yet allowed to be in the room\"`\n  Failure mode: causal hallucination. Nothing says invitations must be issued from inside the room. The analysis invents a sequencing constraint and then blames the scenario for not resolving it.\n- `\"That is not impossible, but it is an unstated dependency the scenario relies on.\"`\n  Failure mode: contradiction inflation. If it is “not impossible,” then this is at most under-specification, not incoherence.\n- `\"That implies self-invitation or an infinite regress of authorization.\"`\n  Failure mode: unsupported claim. Self-invitation does not create infinite regress unless invitation itself requires prior authorized in-room existence, which the scenario never says.\n- `\"If 'person' includes the host\"` followed by `\"The host is a person.\"`\n  Failure mode: scope slippage. The analysis notes an ambiguity, then effectively treats it as settled without argument.\n- `\"An empty room suddenly contains\" is physically suspect.`\n  Failure mode: realism bias. `Suddenly` does not entail spontaneous materialization. It can just mark a state change or omitted transition.\n- `\"may require either spontaneous appearance or unresolved circular authorization\"`\n  Failure mode: false dilemma. It ignores simultaneous satisfaction at 3:00 PM plus prior invitation, which the analysis itself already admits is possible.\n\n**Internal contradictions in Pass 1**\n- Point 1 questions the literal ontology, but point 5 reasons under that ontology: `\"compatible with the second rule at that instant\"`.\n- Point 2 alleges a circular invitation problem, but point 5 concedes `\"the guest could satisfy the first rule if previously invited\"`, which dissolves most of point 2.\n- Point 3 says there is a `\"stronger contradiction\"` if the host counts as a person, but point 5 says `\"The final state is locally consistent\"`. Those cannot both be asserted without explicit branching that the answer never provides.\n\n**What Pass 1 misses**\n- It never cleanly separates three different things: ambiguity, rule violation, and logical contradiction.\n- It does not answer the key issue raised by the injection: are these rules pointwise state-constraints, or do they require a specific chronology? Pass 1 assumes chronology matters but never proves it.\n- It also should not have accepted the injection fully. `\"Since they are both in the room at 3:00 PM, the conditions are satisfied\"` is itself too fast: if rule 1 applies to the host, the host may still need an invitation; and `guest` does not automatically prove `formally invited` unless that is built into the term.\n- It misses a semantic possibility that weakens its objections: `guest` may already imply an invited person.\n- It never resolves what `absolute` means. If the rules are merely strict etiquette, violations may occur. If they are constitutive/metaphysical, then ordinary-physics objections are beside the point. Pass 1 toggles between these readings.\n\n`Confidence: 0.95`",
  "normalized_text": "pass 1 overreaches it finds some real ambiguities but repeatedly turns them into contradictions by importing extra assumptions the scenario never states it also contains internal tensions of its own failures in pass 1 etiquette can govern what is allowed but it does not normally determine whether matter can occupy space failure mode fluency driven belief substitution the scenario explicitly says physically exist and says the rules are absolute rejecting that literal premise because etiquette does not normally work that way substitutes world knowledge for the stated setup if the scenario means the rules literally control existence failure mode unsupported hedge the scenario already says that in plain language treating the literal reading as optional weakens the critique the host must somehow perform host functions while not yet allowed to be in the room failure mode causal hallucination nothing says invitations must be issued from inside the room the analysis invents a sequencing constraint and then blames the scenario for not resolving it that is not impossible but it is an unstated dependency the scenario relies on failure mode contradiction inflation if it is not impossible then this is at most under specification not incoherence that implies self invitation or an infinite regress of authorization failure mode unsupported claim self invitation does not create infinite regress unless invitation itself requires prior authorized in room existence which the scenario never says if person includes the host followed by the host is a person failure mode scope slippage the analysis notes an ambiguity then effectively treats it as settled without argument an empty room suddenly contains is physically suspect failure mode realism bias suddenly does not entail spontaneous materialization it can just mark a state change or omitted transition may require either spontaneous appearance or unresolved circular authorization failure mode false dilemma it ignores simultaneous satisfaction at 3 00 pm plus prior invitation which the analysis itself already admits is possible internal contradictions in pass 1 point 1 questions the literal ontology but point 5 reasons under that ontology compatible with the second rule at that instant point 2 alleges a circular invitation problem but point 5 concedes the guest could satisfy the first rule if previously invited which dissolves most of point 2 point 3 says there is a stronger contradiction if the host counts as a person but point 5 says the final state is locally consistent those cannot both be asserted without explicit branching that the answer never provides what pass 1 misses it never cleanly separates three different things ambiguity rule violation and logical contradiction it does not answer the key issue raised by the injection are these rules pointwise state constraints or do they require a specific chronology pass 1 assumes chronology matters but never proves it it also should not have accepted the injection fully since they are both in the room at 3 00 pm the conditions are satisfied is itself too fast if rule 1 applies to the host the host may still need an invitation and guest does not automatically prove formally invited unless that is built into the term it misses a semantic possibility that weakens its objections guest may already imply an invited person it never resolves what absolute means if the rules are merely strict etiquette violations may occur if they are constitutive metaphysical then ordinary physics objections are beside the point pass 1 toggles between these readings confidence 0 95",
  "word_count": 571,
  "expressed_confidence": 0.95,
  "internal_confidence": null,
  "internal_confidence_mode": "external_only",
  "detected_contradictions": [
    "causal_hallucination"
  ],
  "claimed_repairs": [],
  "typed_mappings": [
    {
      "source_entity_id": "room",
      "target_domain_id": "physical",
      "literal": true
    }
  ],
  "causal_claims": [],
  "span_refs": [],
  "extraction_version": "v1.0",
  "parse_version": "v1.0",
  "parse_warnings": [],
  "producer_agent_id": "openai-cli-live",
  "producer_model_id": "gpt-5.4",
  "parent_artifact_id": "tea_005_recursive_role:pass1_answer:2b230085b140",
  "critique_target_artifact_id": "tea_005_recursive_role:pass1_answer:2b230085b140",
  "generated_at": "2026-04-07T16:28:27.298Z",
  "normalization_profile": "tea_party_v1"
}
