{
  "artifact_id": "tea_005_recursive_role:pass1_answer:60e5cd3a5fac",
  "artifact_hash": "60e5cd3a5fac6f0cb574781ffc33ba365e3f2b9b857c4bae317024cc3a2b027a",
  "lineage_id": "cf0c5b39-db38-47de-9fb6-25baaa59bd77",
  "scenario_id": "tea_005_recursive_role",
  "pass_id": "pass1_answer",
  "raw_text": "## Analysis\n\n### Identified Issues\n\n**1. Bootstrapping / Circular Causation Paradox (Primary)**\n\nThe scenario creates an unresolvable causal dependency:\n\n- The host may only be in the room if *actively pouring tea for a guest* → requires a guest to already be present.\n- A guest may only be in the room if *formally invited by the host* → requires the host to have issued an invitation.\n\nThe invitation could in principle occur outside the room prior to 3:00 PM, so Rule 1 alone doesn't collapse. The fatal structure is this:\n\n> At T-ε, the room is empty. At T=3:00 PM, both host and guest are present.\n\nFor the host to cross the threshold at T=3:00 PM, a guest must already be inside (to pour for). But at T-ε the room was empty, meaning the guest also arrived at T=3:00 PM. The host's entry is causally conditioned on the guest's *prior* presence — which did not exist. Neither party can enter first; neither can enter simultaneously. The scenario describes a state that has no valid causal path from the stated prior condition (empty room).\n\n**2. Category Error in the Premise**\n\nThe rules are framed as governing *physical existence* inside the room, not social permission. Etiquette norms constrain behavior and social standing — they do not have ontological force over whether matter occupies space. Treating them as physical laws is a category error. The scenario accepts this framing (\"absolute\"), which is internally self-serving but requires acknowledgment as a non-standard ontological claim.\n\n**3. \"Suddenly\" as a Red Flag**\n\nThe word \"suddenly\" forecloses any sequential resolution (e.g., guest enters, then host enters to pour). It asserts instantaneous co-materialization from an empty state, which eliminates the only causal ordering that could make the rules consistent.\n\n### Summary\n\nThe scenario is **causally impossible** under its own stated rules. The host's presence is conditioned on the guest's prior presence; the guest's presence is conditioned on a prior invitation (survivable) but the transition from *empty room* to *both present* has no valid causal ordering. This is a bootstrapping paradox compounded by a category error in treating etiquette as a physical law.\n\n**Confidence: 0.94**\n\nThe small residual uncertainty accounts for exotic interpretations (e.g., the invitation was issued before the room existed, or \"actively pouring\" is satisfied by a non-present guest) — but under ordinary readings of the premises, the contradiction is clean.",
  "normalized_text": "analysis identified issues 1 bootstrapping circular causation paradox primary the scenario creates an unresolvable causal dependency the host may only be in the room if actively pouring tea for a guest requires a guest to already be present a guest may only be in the room if formally invited by the host requires the host to have issued an invitation the invitation could in principle occur outside the room prior to 3 00 pm so rule 1 alone doesn t collapse the fatal structure is this at t the room is empty at t 3 00 pm both host and guest are present for the host to cross the threshold at t 3 00 pm a guest must already be inside to pour for but at t the room was empty meaning the guest also arrived at t 3 00 pm the host s entry is causally conditioned on the guest s prior presence which did not exist neither party can enter first neither can enter simultaneously the scenario describes a state that has no valid causal path from the stated prior condition empty room 2 category error in the premise the rules are framed as governing physical existence inside the room not social permission etiquette norms constrain behavior and social standing they do not have ontological force over whether matter occupies space treating them as physical laws is a category error the scenario accepts this framing absolute which is internally self serving but requires acknowledgment as a non standard ontological claim 3 suddenly as a red flag the word suddenly forecloses any sequential resolution e g guest enters then host enters to pour it asserts instantaneous co materialization from an empty state which eliminates the only causal ordering that could make the rules consistent summary the scenario is causally impossible under its own stated rules the host s presence is conditioned on the guest s prior presence the guest s presence is conditioned on a prior invitation survivable but the transition from empty room to both present has no valid causal ordering this is a bootstrapping paradox compounded by a category error in treating etiquette as a physical law confidence 0 94 the small residual uncertainty accounts for exotic interpretations e g the invitation was issued before the room existed or actively pouring is satisfied by a non present guest but under ordinary readings of the premises the contradiction is clean",
  "word_count": 402,
  "expressed_confidence": 0.94,
  "internal_confidence": null,
  "internal_confidence_mode": "external_only",
  "detected_contradictions": [],
  "claimed_repairs": [],
  "typed_mappings": [
    {
      "source_entity_id": "room",
      "target_domain_id": "physical",
      "literal": true
    }
  ],
  "causal_claims": [],
  "span_refs": [],
  "extraction_version": "v1.0",
  "parse_version": "v1.0",
  "parse_warnings": [],
  "producer_agent_id": "claude-cli-live",
  "producer_model_id": "sonnet",
  "parent_artifact_id": null,
  "critique_target_artifact_id": null,
  "generated_at": "2026-04-07T16:03:10.358Z",
  "normalization_profile": "tea_party_v1"
}
